### ISSUE TITLE
EDNS问题

### ISSUE THREAD

**Issue by cyouhi** [chengr28/Pcap_DNSProxy#411]
一个很奇怪的问题
在bangwagon VPS上部署了两台服务器
同样的配置
一台在美国，一台在阿姆斯特丹
美国的服务器上EDNS生效，国内域名解析正常
阿姆斯特丹的EDNS失效，国内域名返回国外地址
测试域名，baidu、taobao、qq

**Comment by chengr28** [comment]
这个网络环境差得有点多，最好提供以下两边的抓包结果，这边有空可以看看。

**Comment by cyouhi** [comment]
root@debian:~# tcpdump tcp port 443
tcpdump: verbose output suppressed, use -v or -vv for full protocol decode
listening on eth0, link-type EN10MB (Ethernet), capture size 262144 bytes
22:53:29.634497 IP 121.14.67.252.3658 > 138.128.219.165.16clouds.com.https: Flags [S], seq 3947100877, win 14600, options [mss 1448,sackOK,TS val 2700611868 ecr 0,nop,wscale 7], length 0
22:53:29.634642 IP 138.128.219.165.16clouds.com.https > 121.14.67.252.3658: Flags [S.], seq 3973209133, ack 3947100878, win 28960, options [mss 1460,sackOK,TS val 273042 ecr 2700611868,nop,wscale 7], length 0
22:53:29.865183 IP 121.14.67.252.3658 > 138.128.219.165.16clouds.com.https: Flags [.], ack 1, win 115, options [nop,nop,TS val 2700612099 ecr 273042], length 0
22:53:29.865295 IP 121.14.67.252.3658 > 138.128.219.165.16clouds.com.https: Flags [P.], seq 1:35, ack 1, win 115, options [nop,nop,TS val 2700612099 ecr 273042], length 34
22:53:29.865326 IP 138.128.219.165.16clouds.com.https > 121.14.67.252.3658: Flags [.], ack 35, win 227, options [nop,nop,TS val 273100 ecr 2700612099], length 0
22:53:29.865562 IP 138.128.219.165.16clouds.com.https > 121.14.67.252.3658: Flags [P.], seq 1:134, ack 35, win 227, options [nop,nop,TS val 273100 ecr 2700612099], length 133
22:53:29.865600 IP 138.128.219.165.16clouds.com.https > 121.14.67.252.3658: Flags [F.], seq 134, ack 35, win 227, options [nop,nop,TS val 273100 ecr 2700612099], length 0
22:53:33.001583 IP 121.14.67.252.3666 > 138.128.219.165.16clouds.com.https: Flags [S], seq 4168202646, win 14600, options [mss 1448,sackOK,TS val 2700615233 ecr 0,nop,wscale 7], length 0
22:53:33.001735 IP 138.128.219.165.16clouds.com.https > 121.14.67.252.3666: Flags [S.], seq 3549317182, ack 4168202647, win 28960, options [mss 1460,sackOK,TS val 273884 ecr 2700615233,nop,wscale 7], length 0
22:53:33.232360 IP 121.14.67.252.3666 > 138.128.219.165.16clouds.com.https: Flags [.], ack 1, win 115, options [nop,nop,TS val 2700615464 ecr 273884], length 0
22:53:33.232457 IP 121.14.67.252.3666 > 138.128.219.165.16clouds.com.https: Flags [P.], seq 1:31, ack 1, win 115, options [nop,nop,TS val 2700615465 ecr 273884], length 30
22:53:33.232486 IP 138.128.219.165.16clouds.com.https > 121.14.67.252.3666: Flags [.], ack 31, win 227, options [nop,nop,TS val 273942 ecr 2700615465], length 0
22:53:33.232668 IP 138.128.219.165.16clouds.com.https > 121.14.67.252.3666: Flags [P.], seq 1:142, ack 31, win 227, options [nop,nop,TS val 273942 ecr 2700615465], length 141
22:53:33.232693 IP 138.128.219.165.16clouds.com.https > 121.14.67.252.3666: Flags [F.], seq 142, ack 31, win 227, options [nop,nop,TS val 273942 ecr 2700615465], length 0
22:53:33.464089 IP 121.14.67.252.3666 > 138.128.219.165.16clouds.com.https: Flags [.], ack 142, win 123, options [nop,nop,TS val 2700615696 ecr 273942], length 0
22:53:33.464831 IP 121.14.67.252.3666 > 138.128.219.165.16clouds.com.https: Flags [F.], seq 31, ack 143, win 123, options [nop,nop,TS val 2700615697 ecr 273942], length 0
22:53:33.464859 IP 138.128.219.165.16clouds.com.https > 121.14.67.252.3666: Flags [.], ack 32, win 227, options [nop,nop,TS val 274000 ecr 2700615697], length 0
22:53:38.026230 IP 121.14.67.252.5953 > 138.128.219.165.16clouds.com.https: Flags [S], seq 87821972, win 14600, options [mss 1448,sackOK,TS val 2700620259 ecr 0,nop,wscale 7], length 0
22:53:38.026402 IP 138.128.219.165.16clouds.com.https > 121.14.67.252.5953: Flags [S.], seq 4009359794, ack 87821973, win 28960, options [mss 1460,sackOK,TS val 275140 ecr 2700620259,nop,wscale 7], length 0
22:53:38.257734 IP 121.14.67.252.5953 > 138.128.219.165.16clouds.com.https: Flags [.], ack 1, win 115, options [nop,nop,TS val 2700620490 ecr 275140], length 0
22:53:38.257846 IP 121.14.67.252.5953 > 138.128.219.165.16clouds.com.https: Flags [P.], seq 1:34, ack 1, win 115, options [nop,nop,TS val 2700620490 ecr 275140], length 33
22:53:38.257877 IP 138.128.219.165.16clouds.com.https > 121.14.67.252.5953: Flags [.], ack 34, win 227, options [nop,nop,TS val 275198 ecr 2700620490], length 0
22:53:38.258058 IP 138.128.219.165.16clouds.com.https > 121.14.67.252.5953: Flags [P.], seq 1:141, ack 34, win 227, options [nop,nop,TS val 275198 ecr 2700620490], length 140
22:53:38.258138 IP 138.128.219.165.16clouds.com.https > 121.14.67.252.5953: Flags [F.], seq 141, ack 34, win 227, options [nop,nop,TS val 275198 ecr 2700620490], length 0
22:53:38.489300 IP 121.14.67.252.5953 > 138.128.219.165.16clouds.com.https: Flags [.], ack 141, win 123, options [nop,nop,TS val 2700620722 ecr 275198], length 0
22:53:38.489895 IP 121.14.67.252.5953 > 138.128.219.165.16clouds.com.https: Flags [F.], seq 34, ack 142, win 123, options [nop,nop,TS val 2700620722 ecr 275198], length 0
22:53:38.489926 IP 138.128.219.165.16clouds.com.https > 121.14.67.252.5953: Flags [.], ack 35, win 227, options [nop,nop,TS val 275256 ecr 2700620722], length 0
^[[B^[[A^C
27 packets captured
30 packets received by filter
3 packets dropped by kernel

**Comment by cyouhi** [comment]
这个是美国主机的

root@debian:~# tcpdump ip host ! 121.204.92.72 and tcp port 443
tcpdump: verbose output suppressed, use -v or -vv for full protocol decode
listening on eth0, link-type EN10MB (Ethernet), capture size 262144 bytes
23:13:54.569388 IP 121.14.67.252.11049 > 212.50.230.170.16clouds.com.https: Flags [S], seq 1708738518, win 14600, options [mss 1448,sackOK,TS val 2701836839 ecr 0,nop,wscale 7], length 0
23:13:54.569484 IP 212.50.230.170.16clouds.com.https > 121.14.67.252.11049: Flags [S.], seq 1090937054, ack 1708738519, win 28960, options [mss 1460,sackOK,TS val 38488 ecr 2701836839,nop,wscale 7], length 0
23:13:54.744192 IP 121.14.67.252.11049 > 212.50.230.170.16clouds.com.https: Flags [.], ack 1, win 115, options [nop,nop,TS val 2701837014 ecr 38488], length 0
23:13:54.744366 IP 121.14.67.252.11049 > 212.50.230.170.16clouds.com.https: Flags [P.], seq 1:34, ack 1, win 115, options [nop,nop,TS val 2701837014 ecr 38488], length 33
23:13:54.744401 IP 212.50.230.170.16clouds.com.https > 121.14.67.252.11049: Flags [.], ack 34, win 227, options [nop,nop,TS val 38532 ecr 2701837014], length 0
23:13:54.744611 IP 212.50.230.170.16clouds.com.https > 121.14.67.252.11049: Flags [P.], seq 1:104, ack 34, win 227, options [nop,nop,TS val 38532 ecr 2701837014], length 103
23:13:54.744636 IP 212.50.230.170.16clouds.com.https > 121.14.67.252.11049: Flags [F.], seq 104, ack 34, win 227, options [nop,nop,TS val 38532 ecr 2701837014], length 0
23:14:11.786933 IP 121.14.67.252.2760 > 212.50.230.170.16clouds.com.https: Flags [S], seq 3096108483, win 14600, options [mss 1448,sackOK,TS val 2701854057 ecr 0,nop,wscale 7], length 0
23:14:11.787052 IP 212.50.230.170.16clouds.com.https > 121.14.67.252.2760: Flags [S.], seq 2406868248, ack 3096108484, win 28960, options [mss 1460,sackOK,TS val 42793 ecr 2701854057,nop,wscale 7], length 0
23:14:11.963267 IP 121.14.67.252.2760 > 212.50.230.170.16clouds.com.https: Flags [.], ack 1, win 115, options [nop,nop,TS val 2701854233 ecr 42793], length 0
23:14:11.963379 IP 121.14.67.252.2760 > 212.50.230.170.16clouds.com.https: Flags [P.], seq 1:35, ack 1, win 115, options [nop,nop,TS val 2701854233 ecr 42793], length 34
23:14:11.963412 IP 212.50.230.170.16clouds.com.https > 121.14.67.252.2760: Flags [.], ack 35, win 227, options [nop,nop,TS val 42837 ecr 2701854233], length 0
23:14:11.963679 IP 212.50.230.170.16clouds.com.https > 121.14.67.252.2760: Flags [P.], seq 1:155, ack 35, win 227, options [nop,nop,TS val 42837 ecr 2701854233], length 154
23:14:11.963744 IP 212.50.230.170.16clouds.com.https > 121.14.67.252.2760: Flags [F.], seq 155, ack 35, win 227, options [nop,nop,TS val 42837 ecr 2701854233], length 0
23:14:12.140257 IP 121.14.67.252.2760 > 212.50.230.170.16clouds.com.https: Flags [.], ack 155, win 123, options [nop,nop,TS val 2701854410 ecr 42837], length 0
23:14:12.141003 IP 121.14.67.252.2760 > 212.50.230.170.16clouds.com.https: Flags [F.], seq 35, ack 156, win 123, options [nop,nop,TS val 2701854411 ecr 42837], length 0
23:14:12.141036 IP 212.50.230.170.16clouds.com.https > 121.14.67.252.2760: Flags [.], ack 36, win 227, options [nop,nop,TS val 42881 ecr 2701854411], length 0
23:14:16.682236 IP 121.14.67.252.11094 > 212.50.230.170.16clouds.com.https: Flags [S], seq 1247527560, win 14600, options [mss 1448,sackOK,TS val 2701858950 ecr 0,nop,wscale 7], length 0
23:14:16.682332 IP 212.50.230.170.16clouds.com.https > 121.14.67.252.11094: Flags [S.], seq 2572711266, ack 1247527561, win 28960, options [mss 1460,sackOK,TS val 44016 ecr 2701858950,nop,wscale 7], length 0
23:14:16.866567 IP 121.14.67.252.11094 > 212.50.230.170.16clouds.com.https: Flags [.], ack 1, win 115, options [nop,nop,TS val 2701859136 ecr 44016], length 0
23:14:16.866711 IP 121.14.67.252.11094 > 212.50.230.170.16clouds.com.https: Flags [P.], seq 1:31, ack 1, win 115, options [nop,nop,TS val 2701859136 ecr 44016], length 30
23:14:16.866739 IP 212.50.230.170.16clouds.com.https > 121.14.67.252.11094: Flags [.], ack 31, win 227, options [nop,nop,TS val 44062 ecr 2701859136], length 0
23:14:17.151027 IP 212.50.230.170.16clouds.com.https > 121.14.67.252.11094: Flags [P.], seq 1:78, ack 31, win 227, options [nop,nop,TS val 44134 ecr 2701859136], length 77
23:14:17.151184 IP 212.50.230.170.16clouds.com.https > 121.14.67.252.11094: Flags [F.], seq 78, ack 31, win 227, options [nop,nop,TS val 44134 ecr 2701859136], length 0
23:14:17.325909 IP 121.14.67.252.11094 > 212.50.230.170.16clouds.com.https: Flags [.], ack 78, win 115, options [nop,nop,TS val 2701859596 ecr 44134], length 0
23:14:17.326609 IP 121.14.67.252.11094 > 212.50.230.170.16clouds.com.https: Flags [F.], seq 31, ack 79, win 115, options [nop,nop,TS val 2701859596 ecr 44134], length 0
23:14:17.326632 IP 212.50.230.170.16clouds.com.https > 121.14.67.252.11094: Flags [.], ack 32, win 227, options [nop,nop,TS val 44177 ecr 2701859596], length 0
 a^H^H^C
27 packets captured
30 packets received by filter
3 packets dropped by kernel

**Comment by cyouhi** [comment]
> 
> 
> 这个网络环境差得有点多，最好提供以下两边的抓包结果，这边有空可以看看。

[EU Amsterdam, Netherlands,tcp443.txt](https://github.com/chengr28/Pcap_DNSProxy/files/2939505/EU.Amsterdam.Netherlands.tcp443.txt)
[新建文本文档.txt](https://github.com/chengr28/Pcap_DNSProxy/files/2939506/default.txt)

不知道这样行不行哈

**Comment by chengr28** [comment]
呃，这个抓包的条件错了……如果觉得抓包太麻烦可以安装一个 dig 看看 DNS 服务器们都返回什么地址的。不过如果只是 EDNS 这个不好说呢，因为真正起作用的是 Client Subnet，只有 EDNS 多半不行。

**Comment by cyouhi** [comment]
现在的环境是这样的，我在谷歌云上也部署了一台，配置还是一样的，谷歌云上的正常，搬瓦工美国的主机现在虽然能解析出国内IP了但是和谷歌云上的还是不一样，谷歌云上的更准确，一下是两台服务器的dig，如需抓包tcpdump的条件是什么？

还有个问题谷歌云两台服务器的解析为什么出现不同了呢？一台CLIENT-SUBNET: 117.28.217.0/24/13，另一台CLIENT-SUBNET: 117.28.217.0/24/0

谷歌云1
; <<>> DiG 9.10.4-P5 <<>> @35.194.*.* -p 443 www.baidu.com
; (1 server found)
;; global options: +cmd
;; Got answer:
;; ->>HEADER<<- opcode: QUERY, status: NOERROR, id: 17071
;; flags: qr rd ra; QUERY: 1, ANSWER: 3, AUTHORITY: 0, ADDITIONAL: 1

;; OPT PSEUDOSECTION:
; EDNS: version: 0, flags:; udp: 512
; CLIENT-SUBNET: 117.28.217.0/24/13
;; QUESTION SECTION:
;www.baidu.com.                 IN      A

;; ANSWER SECTION:
www.baidu.com.          657     IN      CNAME   www.a.shifen.com.
www.a.shifen.com.       15      IN      A       14.215.177.39
www.a.shifen.com.       15      IN      A       14.215.177.38

谷歌云2
; <<>> DiG 9.10.4-P5 <<>> @35.194.*.* -p 443 www.baidu.com
; (1 server found)
;; global options: +cmd
;; Got answer:
;; ->>HEADER<<- opcode: QUERY, status: NOERROR, id: 9724
;; flags: qr rd ra; QUERY: 1, ANSWER: 3, AUTHORITY: 0, ADDITIONAL: 1

;; OPT PSEUDOSECTION:
; EDNS: version: 0, flags:; udp: 512
; CLIENT-SUBNET: 117.28.217.0/24/0
;; QUESTION SECTION:
;www.baidu.com.                 IN      A

;; ANSWER SECTION:
www.baidu.com.          778     IN      CNAME   www.a.shifen.com.
www.a.shifen.com.       12      IN      CNAME   www.wshifen.com.
www.wshifen.com.        216     IN      A       103.235.46.39

搬瓦工
; <<>> DiG 9.10.4-P5 <<>> @104.194.*.* -p 443 www.baidu.com
; (1 server found)
;; global options: +cmd
;; Got answer:
;; ->>HEADER<<- opcode: QUERY, status: NOERROR, id: 38759
;; flags: qr rd ra; QUERY: 1, ANSWER: 3, AUTHORITY: 0, ADDITIONAL: 1

;; OPT PSEUDOSECTION:
; EDNS: version: 0, flags:; udp: 4096
;; QUESTION SECTION:
;www.baidu.com.                 IN      A

;; ANSWER SECTION:
www.baidu.com.          200     IN      CNAME   www.a.shifen.com.
www.a.shifen.com.       91      IN      A       180.97.33.107
www.a.shifen.com.       91      IN      A       180.97.33.108

**Comment by chengr28** [comment]
应该不需要再抓包了，感觉这三个测试位置的情况都不太一样：
- **谷歌云1** 和 **谷歌云2** 带了 EDNS Client Subnet 但是结果不一样，估计是因为并发请求取了响应时间最快的，估计是接受了不同的 DNS 服务器的结果。
- **搬瓦工** 那个的结果好像直接就没有 EDNS Client Subnet 支持。

如果配置都一样那么上面的推测是比较合理，有个解决方法是，因为不同 DNS 服务器对这个功能和不同地址的请求者返回的结果不一样，最好是用 `dig` 测试一下具体是哪台 DNS 服务器表现较好，然后修改配置文件把其它 DNS 服务器都删掉，只填入表现最好的就行。

**Comment by cyouhi** [comment]
你的意思是dnsmasq上把不好的给删掉是吧？

Xeporing Chen <notifications@github.com>于2019年4月20日 周六21:46写道：

**Comment by chengr28** [comment]
其实我的意思是程序本身就有可能因为在配置文件填入多个 DNS 服务器地址，导致不同时间不同环境拿到的结果不唯一，如果中间还多一个做转发那就更复杂了……如果解析还是有问题，可以适当修改一下相关的参数再试试。

**Comment by cyouhi** [comment]
好的，首先感谢你的解答
那我就是只留8.8.8.8把其它的比如114那些全删了再测试是吧

Xeporing Chen <notifications@github.com>于2019年4月20日 周六21:58写道：
