### ISSUE TITLE
ubuntu14.04 lts下BUG

### ISSUE THREAD

**Issue by xieqiyou** [chengr28/Pcap_DNSProxy#106]
在自己vps上准备给自己搞个无污染的DNS服务
监听非标准的53端口
[DNS]参数下
Protocol = IPv4 + UDP
不能用UDP协议解析全部都超时，加上TCP协议就可以正常解析
开启Local Hosts = 1后
[Local DNS]参数
Local Protocol = IPv4 + UDP
在白名单里面的域名可以正常解析，白名单外的域名要用到主DNS时候就无法正常解析了

**Comment by gaoyan1234** [comment]
小白同问 如何在vps上安装

**Comment by chengr28** [comment]
你可以开启 Direct Request 直连模式试试，主 DNS 服务器请求的部分不行可能是抓包模块那边的问题，因为主要的请求流量都是通过抓包抓回来的，同时也建议检查下有没有 Error.log 之类的问题

**Comment by xieqiyou** [comment]
@chengr28 开启直连可以正常解析。。等会装个wireshark看看

**Comment by xieqiyou** [comment]
@chengr28 可以正常识别是venet,
也没有错误日志，不过vps上libpcap有两个版本一个是1.5.2一个是1.7.0的会有影响么？

**Comment by chengr28** [comment]
程序的抓包模块是会忽略 Loopback 的网卡的……看样子 VPS 上真正在与外部网络传输数据的网卡用的是换回地址？希望能提供以下邮箱，给你发一份去掉这个限制的源代码，在 VPS 上重新编译并把 Direct Request 关掉运行一下看看是不是可以解决这个问题……

**Comment by xieqiyou** [comment]
@chengr28 xieqiming1987@gmail.com谢谢
127.0.0.1不是用于传输数据啊，ifconfig全部信息上看我所有vps上的信息是通过vennet0来127.0.0.2来转发的抓包软件抓的也是vennet0的数据
lo        Link encap:Local Loopback
          inet addr:127.0.0.1  Mask:255.0.0.0
          inet6 addr: ::1/128 Scope:Host
          UP LOOPBACK RUNNING  MTU:65536  Metric:1
          RX packets:46555 errors:0 dropped:0 overruns:0 frame:0
          TX packets:46555 errors:0 dropped:0 overruns:0 carrier:0
          collisions:0 txqueuelen:0
          RX bytes:3171274 (3.1 MB)  TX bytes:3171274 (3.1 MB)

venet0    Link encap:UNSPEC  HWaddr 00-00-00-00-00-00-00-00-00-00-00-00-00-00-00-00
          inet addr:127.0.0.2  P-t-P:127.0.0.2  Bcast:0.0.0.0  Mask:255.255.255.255
          UP BROADCAST POINTOPOINT RUNNING NOARP  MTU:1500  Metric:1
          RX packets:2072524 errors:0 dropped:0 overruns:0 frame:0
          TX packets:1789527 errors:0 dropped:0 overruns:0 carrier:0
          collisions:0 txqueuelen:0
          RX bytes:1991841268 (1.9 GB)  TX bytes:1974015741 (1.9 GB)

venet0:0  Link encap:UNSPEC  HWaddr 00-00-00-00-00-00-00-00-00-00-00-00-00-00-00-00
          inet addr:公网IP  P-t-P:公网IP  Bcast:198.35.44.87  Mask:255.255.255.255
          UP BROADCAST POINTOPOINT RUNNING NOARP  MTU:1500  Metric:1

**Comment by xieqiyou** [comment]
@chengr28 还是不行，解析的包发出去了，DNS也回文了，dig里却解析不出来
饿，看tcpdump貌似程序会时不时的发送bj4hhd9ipknzsmwcqg8dkihrmrwwrgolq8a.kw这类随机的地址给dns解析，干啥用的说？
tcpdump udp的日志
10:04:37.429033 IP 公网IP.33357 > google-public-dns-a.google.com.domain: 28529+ [1au] A? wWw.fAcEbOoK.CoM. (45)
10:04:37.438496 IP google-public-dns-a.google.com.domain > 公网IP.33357: 28529 2/0/1 CNAME star-mini.c10r.fAcEbOoK.CoM., A 31.13.70.36 (90)
10:04:41.335645 IP 公网IP.34885 > google-public-dns-a.google.com.domain: 59136+ [1au] A? bj4hhd9ipknzsmwcqg8dkihrmrwwrgolq8a.kw. (67)
10:04:41.390202 IP google-public-dns-a.google.com.domain > 公网IP.34885: 59136 NXDomain 0/1/1 (113)
10:04:42.426004 IP 公网IP.59605 > google-public-dns-a.google.com.domain: 28529+ [1au] A? WwW.FaCeBoOk.cOm. (45)
10:04:42.435869 IP google-public-dns-a.google.com.domain > 公网IP.59605: 28529 2/0/1 CNAME star-mini.c10r.FaCeBoOk.cOm., A 31.13.70.36 (90)
10:04:47.428839 IP 公网IP.40483 > google-public-dns-a.google.com.domain: 28529+ [1au] A? wWw.fAcEbOoK.CoM. (45)
10:04:47.438010 IP google-public-dns-a.google.com.domain > 公网IP.40483: 28529 2/0/1 CNAME star-mini.c10r.fAcEbOoK.CoM., A 31.13.70.36 (90)
10:04:48.356089 IP 公网IP.36110 > google-public-dns-a.google.com.domain: 59136+ [1au] A? oexlusjeil8lhzgkiecvu8dr5iidn8sic.du. (65)
10:04:48.391288 IP google-public-dns-a.google.com.domain > 公网IP.36110: 59136 NXDomain 0/1/1 (140)
10:05:00.376513 IP 公网IP.55510 > google-public-dns-a.google.com.domain: 59136+ [1au] A? js5shj66pebnicusl8xeba6klazuhb6l79h.hli. (68)
10:05:00.445501 IP google-public-dns-a.google.com.domain > 公网IP.55510: 59136 NXDomain 0/1/1 (143)
10:05:07.396928 IP 公网IP.49788 > google-public-dns-a.google.com.domain: 59136+ [1au] A? lrukbgihdvxkjaotv9rix.ntu. (54)
10:05:07.593713 IP google-public-dns-a.google.com.domain > 公网IP.49788: 59136 NXDomain 0/1/1 (129)
10:05:14.417373 IP 公网IP.41804 > google-public-dns-a.google.com.domain: 59136+ [1au] A? frjolbvoworaq.jh. (45)

**Comment by chengr28** [comment]
随机域名是用来获取真正的远程 DNS 服务器参数的……就是类似给过滤模块提供参考

**Comment by chengr28** [comment]
邮件发过去了……可以试试，或者直接上新版本看看怎么样
这情况看来是抓包模块没有正常在工作的缘故
